{
  "id": "test_game",
  "version": "1.0.0",
  "sdkVersion": "^0.1.0",
  "displayName": { "en": "Test Game" },
  "input": ["hands"],
  "paramSchema": {
    "type": "object",
    "properties": { "difficulty": { "type": "integer", "minimum": 1, "maximum": 5 } }
  },
  "events": ["session_start", "session_end"],
  "metrics": ["reaction_time_ms"]
}
